{
  "$schema": "http://json-schema.org/draft-07/schema#",
  "$id": "http://localhost:8000/draft-07/schemas/v2/security/securitySchema.json",
  "title": "AsyncAPI v2 - Authentication Variants",
  "description": "Contains information about available authentication variants",
  "examples": [
    {
      "type": "httpApiKey",
      "description": "httpApiKey",
      "name": "api_key",
      "in": "header"
    },
    {
      "type": "http",
      "description": "http",
      "scheme": "basic"
    },
    {
      "type": "http",
      "description": "http",
      "scheme": "bearer",
      "bearerFormat": "JWT"
    },
    {
      "type": "oauth2",
      "description": "oauth2",
      "flows": {
        "authorizationCode": {
          "authorizationUrl": "https://example.com/api/oauth/dialog",
          "tokenUrl": "https://example.com/api/oauth/token",
          "refreshUrl": "https://example.com/api/oauth/refresh",
          "scopes": {
            "write:pets": "modify pets in your account",
            "read:pets": "read your pets"
          }
        },
        "clientCredentials": {
          "tokenUrl": "https://example.com/api/oauth/token",
          "refreshUrl": "https://example.com/api/oauth/refresh",
          "scopes": {
            "write:pets": "modify pets in your account",
            "read:pets": "read your pets"
          }
        },
        "implicit": {
          "authorizationUrl": "https://example.com/api/oauth/dialog",
          "refreshUrl": "https://example.com/api/oauth/refresh",
          "scopes": {
            "write:pets": "modify pets in your account",
            "read:pets": "read your pets"
          }
        },
        "password": {
          "tokenUrl": "https://example.com/api/oauth/token",
          "refreshUrl": "https://example.com/api/oauth/refresh",
          "scopes": {
            "write:pets": "modify pets in your account",
            "read:pets": "read your pets"
          }
        }
      },
      "scopes": [ "write:pets", "read:pets" ]
    },
    {
      "type": "X509",
      "description": "X509"
    },
    {
      "type": "apiKey",
      "description": "apiKey",
      "in": "user"
    },
    {
      "type": "asymmetricEncryption",
      "description": "asymmetricEncryption"
    },
    {
      "type": "gssapi",
      "description": "gssapi"
    },
    {
      "type": "openIdConnect",
      "description": "openIdConnect",
      "openIdConnectUrl": "https://server.com/.well-known/openid-configuration"
    },
    {
      "type": "plain",
      "description": "plain"
    },
    {
      "type": "scramSha256",
      "description": "scramSha256"
    },
    {
      "type": "scramSha512",
      "description": "scramSha512"
    },
    {
      "type": "symmetricEncryption",
      "description": "symmetricEncryption"
    },
    {
      "type": "userPassword",
      "description": "userPassword"
    }
  ],
  "oneOf": [
    {
      "$ref": "http://localhost:8000/draft-07/schemas/v2/security/userPassword.json"
    },
    {
      "$ref": "http://localhost:8000/draft-07/schemas/v2/security/apiKey.json"
    },
    {
      "$ref": "http://localhost:8000/draft-07/schemas/v2/security/X509.json"
    },
    {
      "$ref": "http://localhost:8000/draft-07/schemas/v2/security/symmetricEncryption.json"
    },
    {
      "$ref": "http://localhost:8000/draft-07/schemas/v2/security/asymmetricEncryption.json"
    },
    {
      "$ref": "http://localhost:8000/draft-07/schemas/v2/security/http/httpSecuritySchema.json"
    },
    {
      "$ref": "http://localhost:8000/draft-07/schemas/v2/security/oauth2/oauth2.json"
    },
    {
      "$ref": "http://localhost:8000/draft-07/schemas/v2/security/openIdConnect.json"
    },
    {
      "$ref": "http://localhost:8000/draft-07/schemas/v2/security/sasl/saslSecuritySchema.json"
    }
  ]
}
