{
  "type": "object",
  "additionalProperties": {
    "$ref": "http://asyncapi.com/definitions/2.0.0-rc2/parameter"
  },
  "description": "JSON objects describing re-usable channel parameters.",
  "$schema": "http://json-schema.org/draft-07/schema#",
  "$id": "http://asyncapi.com/definitions/2.0.0-rc2/parameters"
}