{
  "$schema": "http://json-schema.org/draft-07/schema#",
  "$id": "http://localhost:8000/draft-07/schemas/v2.2.0/channels/messages/messages.json",
  "title": "AsyncAPI v2.2.0 - Channel Operation Messages Map",
  "description": "A key-value map where key is message ID and value is message representation",
  "type": "object",
  "examples": [
    {
      "userSignup": {
        "$ref": "#/components/messages/userSignup"
      }
    },
    {
      "userSignup": {
        "name": "UserSignup",
        "title": "User signup",
        "summary": "Action to sign a user up.",
        "description": "A longer description",
        "tags": [
          { "name": "user" },
          { "name": "signup" },
          { "name": "register" }
        ],
        "payload": {
          "$ref": "path/to/user-create.avsc#/UserCreate"
        }
      }
    }
  ],
  "additionalProperties": {
    "$ref": "http://localhost:8000/draft-07/schemas/v2.2.0/channels/messages/message.json"
  }
}
