{
  "type": "object",
  "additionalProperties": {
    "$ref": "http://asyncapi.com/definitions/2.4.0/parameter.json"
  },
  "description": "JSON objects describing re-usable channel parameters.",
  "$schema": "http://json-schema.org/draft-07/schema#",
  "$id": "http://asyncapi.com/definitions/2.4.0/parameters.json"
}